{
  "academic_experiences": [
    {
      "department": "Department of Informatics, Systems and Communication",
      "link": "https://cremarco.github.io/cv/files/contratti-precedenti/09-contratto-di-ricerca-01-04-2026-31-03-2028.pdf",
      "logo": "unimib.png",
      "place": "Milan, Italy",
      "position": "Research Contract (Contrattista di Ricerca)",
      "ssd": "INFO-01/A",
      "time_period": "01 Apr 2026 - 31 Mar 2028",
      "topic": "Data architectures and Machine Learning for predictive maintenance of corporate fleets",
      "topic_it": "Architetture dati e Machine Learning per la manutenzione predittiva di flotte aziendali",
      "university": "University of Milan-Bicocca"
    },
    {
      "department": "Department of Informatics, Systems and Communication",
      "link": "https://cremarco.github.io/cv/files/contratti-precedenti/08-assegno-01-02-2025-31-01-2026.pdf",
      "logo": "unimib.png",
      "place": "Milan, Italy",
      "position": "Research Assistant (Assegnista di Ricerca)",
      "ssd": "INF/01",
      "time_period": "01 Feb 2025 - 31 Jan 2026",
      "topic": "Design and development of an Artificial Intelligence/Machine Learning model for creating a decision support system in the psychological/psychiatric field",
      "topic_it": "Progettazione e sviluppo di un modello di Intelligenza Artificiale/Machine Learning per la creazione di un sistema di supporto alle decisioni in campo psicologico/psichiatrico",
      "university": "University of Milan-Bicocca"
    },
    {
      "department": "Department of Informatics, Systems and Communication",
      "link": "https://cremarco.github.io/cv/files/contratti-precedenti/07-rtda-10-01-2022-09-01-2025.pdf",
      "logo": "unimib.png",
      "place": "Milan, Italy",
      "position": "Assistant Professor (RTD/A)",
      "ssd": "INF/01",
      "time_period": "10 Jan 2022 - 09 Jan 2025",
      "topic": "Semantic and AI technologies for early digital intervention in psychiatric services, funded by the Italian Ministero dell'Università e della Ricerca through the European project D.M. 1062/2021 – Piano Operativo Nazionale - PON \"Ricerca e Innovazione\" 2014- 2020 Asse IV, azioni IV.4 \"Dottorati e contratti di ricerca sulle tematiche dell'innovazione\"",
      "topic_it": "Tecnologie semantiche e di AI per Intervento Digitale Precoce nei Servizi Psichiatrici",
      "university": "University of Milan-Bicocca"
    },
    {
      "department": "Department of Informatics, Systems and Communication",
      "link": "https://cremarco.github.io/cv/files/contratti-precedenti/06-assegno-01-02-2021-31-01-2022.pdf",
      "logo": "unimib.png",
      "place": "Milan, Italy",
      "position": "Research Assistant (Assegnista di Ricerca)",
      "ssd": "ING-INF/05",
      "time_period": "01 Feb 2021 - 31 Jan 2022",
      "topic": "Analysis and semantic annotation of data related to the nutritional components of food",
      "topic_it": "Analisi e annotazione semantica di dati relativi ai componenti nutrizionali dei cibi",
      "university": "University of Milan-Bicocca"
    },
    {
      "department": "Department of Informatics, Systems and Communication",
      "link": "https://cremarco.github.io/cv/files/contratti-precedenti/05-assegno-01-02-2020-31-01-2021.pdf",
      "logo": "unimib.png",
      "place": "Milan, Italy",
      "position": "Research Assistant (Assegnista di Ricerca)",
      "ssd": "ING-INF/05",
      "time_period": "01 Feb 2020 - 31 Jan 2021",
      "topic": "Analysis and semantic annotation of data related to the nutritional components of food",
      "topic_it": "Analisi e annotazione semantica di dati relativi ai componenti nutrizionali dei cibi",
      "university": "University of Milan-Bicocca"
    },
    {
      "department": "Department of Informatics, Systems and Communication",
      "link": "https://cremarco.github.io/cv/files/contratti-precedenti/04-assegno-01-11-2015-31-10-2016.pdf",
      "logo": "unimib.png",
      "place": "Milan, Italy",
      "position": "Research Assistant (Assegnista di Ricerca)",
      "ssd": "ING-INF/05",
      "time_period": "01 Nov 2015 - 31 Oct 2016",
      "topic": "Definition and implementation of the UniData centre's data architecture",
      "topic_it": "Definizione e implementazione dell'architettura dati del centro UniData",
      "university": "University of Milan-Bicocca"
    },
    {
      "department": "Department of Informatics, Systems and Communication",
      "link": "https://cremarco.github.io/cv/files/contratti-precedenti/03-assegno-01-09-2014-31-08-2015.pdf",
      "logo": "unimib.png",
      "place": "Milan, Italy",
      "position": "Research Assistant (Assegnista di Ricerca)",
      "ssd": "ING-INF/05",
      "time_period": "01 Sep 2014 - 31 Aug 2015",
      "topic": "Definition of tools for the population of semantic services for public administration",
      "topic_it": "Definizione di strumenti per il popolamento di servizi semantici per la pubblica amministrazione",
      "university": "University of Milan-Bicocca"
    },
    {
      "department": "Department of Informatics, Systems and Communication",
      "link": "https://cremarco.github.io/cv/files/contratti-precedenti/02-assegno-01-09-2013-31-08-2014.pdf",
      "logo": "unimib.png",
      "place": "Milan, Italy",
      "position": "Research Assistant (Assegnista di Ricerca)",
      "ssd": "ING-INF/05",
      "time_period": "01 Sep 2013 - 31 Aug 2014",
      "topic": "Development of software components for the efficient implementation of semantic technologies for extraction, processing, and fruition of information on the web. Access to web services via mobile channels",
      "topic_it": "Sviluppo di componenti software per la implementazione efficiente di tecnologie semantiche di estrazione, elaborazione, fruizione della informazione nel web. Accesso a servizi web tramite canali mobili",
      "university": "University of Milan-Bicocca"
    },
    {
      "department": "Department of Informatics, Systems and Communication",
      "link": "https://cremarco.github.io/cv/files/contratti-precedenti/01-borsa-01-02-2011-31-01-2012.pdf",
      "logo": "unimib.png",
      "place": "Milan, Italy",
      "position": "Research fellow",
      "ssd": "ING-INF/09",
      "time_period": "01 Feb 2011 - 31 Jan 2012",
      "topic": "Development Methodologies for Value-Added Services in Agriculture",
      "topic_it": "Metodologie di sviluppo di servizi a valore aggiunto per l'agricoltura",
      "university": "University of Milan-Bicocca"
    }
  ],
  "foreign_research_contracts": [
    {
      "link": "https://cremarco.github.io/cv/files/contratti-precedenti/Estero/08-intertwino-20-04-2022-31-03-2024.pdf",
      "logo": "sofia.png",
      "place": "Sofia, Bulgaria",
      "position": "Researcher",
      "time_period": "20 Apr 2022 - 31 Mar 2024",
      "topic": "Holder of a research contract on the topic \"Building competence in data enrichment for artificial intelligence,\" financed by the Bulgarian Ministry of Education and Science, as part of the implementation of the national program \"European Science Network.\" Big Data for Smart Society Institute.",
      "university": "Sofia University \"St. Kliment Ohridski\""
    },
    {
      "link": "https://cremarco.github.io/cv/files/contratti-precedenti/Estero/07-intertwino-15-07-2021-31-03-2022.pdf",
      "logo": "sofia.png",
      "place": "Sofia, Bulgaria",
      "position": "Researcher",
      "time_period": "15 Jul 2021 - 31 Mar 2022",
      "topic": "Holder of a research contract on the topic \"Building competence in data enrichment for artificial intelligence,\" financed by the Bulgarian Ministry of Education and Science, as part of the implementation of the national program \"European Science Network.\" Big Data for Smart Society Institute.",
      "university": "Sofia University \"St. Kliment Ohridski\""
    },
    {
      "logo": "bielefeld.png",
      "place": "Bielefeld, Germany",
      "position": "Researcher",
      "time_period": "Nov 2018 - Apr 2019",
      "topic": "Research internship abroad through the Erasmus+ Traineeship program. Semantic Computing Group.",
      "university": "Bielefeld University"
    }
  ],
  "research_and_technology_transfer": [
    {
      "company": "WhattaData srl",
      "logo": "whattadata.png",
      "place": "Milan, Italy",
      "position": "CTO, Co-founder (60% equity stake)",
      "time_period": "11 Apr 2025 - Present",
      "topic": "Approval as a university spin-off was deliberated by the Academic Senate of the University of Milan-Bicocca on 3 March 2025 and ratified by the Board of Directors of the University of Milan-Bicocca on 18 March 2025."
    },
    {
      "company": "Aton Informatica s.r.l.",
      "logo": "aton.png",
      "place": "Rome, Italy",
      "position": "Consultant",
      "time_period": "11 Mar 2019 - 31 Aug 2025",
      "topic": "I provided hands-on R&D and technical consultancy, spanning software development, data/AI analytics and advanced digital solutions, across multiple publicly funded innovation projects."
    },
    {
      "company": "Nana Bianca/Instal srl",
      "logo": "nanabianca.png",
      "place": "Milan, Italy",
      "position": "Consultant",
      "time_period": "01 Apr 2020 - 31 May 2020",
      "topic": "Definition of a software architecture based on LSTM algorithms for the lexicalization of RDF data."
    },
    {
      "company": "Umbria Digitale S.c. a r.l.",
      "logo": "umbria.png",
      "place": "Perugia, Italy",
      "position": "Consultant",
      "time_period": "15 Aug 2015 - 15 Aug 2016",
      "topic": "Consultancy on semantic technologies for public administration services, with focus on service interoperability, data integration and digital process support."
    }
  ],
  "entrepreneurial_initiatives": [
    {
      "company": "Whattaspot srl",
      "logo": "whattaspot.png",
      "place": "Bergamo, Italy",
      "position": "CEO, Co-funder",